{
  "artifact_type": "JOYFLOW_PR_RECORD",
  "record_version": 4,
  "record_phase": "READY_FOR_USER_DECISION",
  "repository_id": "example/repo",
  "pr_number": 42,
  "base_sha": "03d691ce70c8703e6e719e1063c01040f405894f",
  "head_sha": "f8a5f006b48461efacd6573638d0ee74af1bcd53",
  "brain_block": {
    "block_version": 4,
    "writer_role": "WEB_BRAIN",
    "execution_binding": {
      "repository_id": "example/repo",
      "project_id": "JOYFLOW_DEVELOPMENT",
      "task_id": "TASK_PHASE1E_AI_NATIVE_CHANGE_PROJECTION_REPAIR",
      "round_id": 1,
      "expected_base_commit": "03d691ce70c8703e6e719e1063c01040f405894f",
      "current_head_sha": "f8a5f006b48461efacd6573638d0ee74af1bcd53",
      "projection_digest": "8e67cc6387cae209a5579bf8fe2e94832fdbb35ec9e35648dbe39917ffe17fb6",
      "final_path_decision_digest": "3c25b572ee4519f5d12ff1d982dbafc3f79d227c39a55c806bc17248ada02edf",
      "approval_binding_digest": "b9c7d60f6a415c5f4866f9446a2aadbe193e5945562d3dbf7102db7da651cfa4",
      "approved_allowed_paths": [
        "runtime/**"
      ]
    },
    "semantic_context": [
      "Current PR is reviewed against the exact approved Projection and repository source."
    ],
    "selected_technical_route": [
      "Retain Codex bounded technical choice inside the approved paths."
    ],
    "non_goals": [
      "No automatic approval, acceptance, merge or promotion."
    ],
    "preserved_invariants": [
      "Single Web Brain, single Codex execution layer, user key gates and repository fact source."
    ],
    "brain_review": {
      "status": "PASS",
      "reviewed_head_sha": "f8a5f006b48461efacd6573638d0ee74af1bcd53",
      "source_projection_digest": "8e67cc6387cae209a5579bf8fe2e94832fdbb35ec9e35648dbe39917ffe17fb6",
      "source_final_path_decision_digest": "3c25b572ee4519f5d12ff1d982dbafc3f79d227c39a55c806bc17248ada02edf",
      "source_codex_return_digest": "9d53f28f01509a8d0d384cc851bf4e1acf47a7eef371c3a193c75ba22ac84724",
      "source_evidence_bundle_digest": "873da4b0e36030626636ea5b7589cd62a5a3e3ee9b907b2bbd880c3e9de47bca",
      "source_codex_block_digest": "bb2ac21bf33d62f727822537b249e25d29361debbde7b2dc2fa0a7174d16adcd",
      "source_brain_review_capsule_digest": "9d6006d72053faef13172b5e7be4d4cb1f521e93d6fb02fe59913c35512b75a9",
      "unresolved_items": []
    },
    "merged_change_projection": null,
    "brain_block_digest": "8eb750a9619827ee948b40d2f4e107ffe2b62bd22a2cd62d44ed7609ed50bc1a"
  },
  "codex_block": {
    "block_version": 4,
    "writer_role": "CODEX",
    "technical_preflight_status": "ROUTE_CONFIRMED",
    "source_codex_return_digest": "9d53f28f01509a8d0d384cc851bf4e1acf47a7eef371c3a193c75ba22ac84724",
    "source_evidence_bundle_digest": "873da4b0e36030626636ea5b7589cd62a5a3e3ee9b907b2bbd880c3e9de47bca",
    "execution": {
      "status": "COMPLETED",
      "checked_base_sha": "03d691ce70c8703e6e719e1063c01040f405894f",
      "checked_head_sha": "f8a5f006b48461efacd6573638d0ee74af1bcd53",
      "actual_changed_paths": [
        "runtime/joyflow_dual_layer.py"
      ],
      "actual_changed_paths_digest": "f6285b352b9be07000f0df292da4ec0221ee0a724431877c5f9b517af0d1ce03",
      "changed_symbols": [
        "joyflow_phase1_review"
      ],
      "implementation_mechanisms": [
        "current_repository_source_replay",
        "sealed_object_consumption"
      ]
    },
    "local_test_refs": [
      "python tools/run_test_suite.py"
    ],
    "evidence_refs": [
      "EXEC_DIFF",
      "EXEC_VAL_E_APPROVAL_VALIDATE_CHECK_UNIT",
      "EXEC_VAL_E_AUTO_VALIDATE_CHECK_UNIT",
      "EXEC_VAL_E_BUNDLE_VALIDATE_CHECK_UNIT",
      "EXEC_VAL_E_CODEX_AUTHORITY_VALIDATE_CHECK_UNIT",
      "EXEC_VAL_E_CONTEXT_VALIDATE_CHECK_UNIT",
      "EXEC_VAL_E_CONT_VALIDATE_CHECK_UNIT",
      "EXEC_VAL_E_GATE_VALIDATE_CHECK_UNIT",
      "EXEC_VAL_E_GOAL_VALIDATE_CHECK_UNIT",
      "EXEC_VAL_E_MERGE_CONT_VALIDATE_CHECK_UNIT",
      "EXEC_VAL_E_MERGE_VALIDATE_CHECK_UNIT",
      "EXEC_VAL_E_PATH_DISCOVERY_VALIDATE_CHECK_UNIT",
      "EXEC_VAL_E_REPO_VALIDATE_CHECK_UNIT",
      "EXEC_VAL_E_REVIEW_SPLIT_VALIDATE_CHECK_UNIT",
      "EXEC_VAL_E_SINGLE_ROUND_VALIDATE_CHECK_UNIT",
      "EXEC_VAL_E_TEMP_VALIDATE_CHECK_UNIT",
      "EXEC_VAL_E_TRANSPORT_VALIDATE_CHECK_UNIT"
    ],
    "unresolved_items": [],
    "codex_block_digest": "bb2ac21bf33d62f727822537b249e25d29361debbde7b2dc2fa0a7174d16adcd"
  },
  "record_digest": "8edf2b8928a07a0be71e43756327b87c19d31c08d4ff8097724177702dbe7f69"
}
